{"$id":"https://aurora.invalid/schemas/readiness/gtbi_v7_readiness_transition_manifest_v1","$schema":"https://json-schema.org/draft/2020-12/schema","additionalProperties":false,"properties":{"actor_id":{"minLength":1,"type":"string"},"actor_role":{"const":"repository_owner"},"branch_actions":{"items":{"additionalProperties":false,"properties":{"branch_id":{"minLength":1,"type":"string"},"decision_receipt_digest":{"pattern":"^sha256:[0-9a-f]{64}$","type":"string"},"predicate_evidence_digest":{"pattern":"^sha256:[0-9a-f]{64}$","type":"string"},"selected_successor":{"minLength":1,"type":"string"},"task_id":{"pattern":"^PREV7-[0-9]{4}$","type":"string"}},"required":["branch_id","task_id","selected_successor","predicate_evidence_digest","decision_receipt_digest"],"type":"object"},"type":"array"},"expected_base_ref":{"const":"refs/heads/main"},"expected_base_sha_mode":{"const":"runtime_default_branch_head"},"gate_actions":{"items":{"additionalProperties":false,"properties":{"evidence_bundle_digest":{"pattern":"^sha256:[0-9a-f]{64}$","type":"string"},"gate_id":{"pattern":"^G(?:0|1A|1B|2|3A|3B|4|5|6|7|8|9|9X|10)$","type":"string"},"inventory_snapshot_digest":{"pattern":"^sha256:[0-9a-f]{64}$","type":"string"},"selected_branch_id_or_null":{"anyOf":[{"type":"string"},{"type":"null"}]},"target_status":{"enum":["green","not_applicable"]}},"required":["gate_id","target_status","selected_branch_id_or_null","inventory_snapshot_digest","evidence_bundle_digest"],"type":"object"},"type":"array"},"manifest_digest":{"pattern":"^sha256:[0-9a-f]{64}$","type":"string"},"manifest_id":{"pattern":"^[a-z0-9][a-z0-9_-]{0,63}$","type":"string"},"owner_directive_digest":{"pattern":"^sha256:[0-9a-f]{64}$","type":"string"},"requested_at_utc":{"format":"date-time","type":"string"},"schema_version":{"const":"gtbi_v7_readiness_transition_manifest_v1"},"task_actions":{"items":{"additionalProperties":false,"properties":{"alternative_completion_receipt_set_digest_or_null":{"anyOf":[{"pattern":"^sha256:[0-9a-f]{64}$","type":"string"},{"type":"null"}]},"evidence_paths":{"items":{"pattern":"^docs/readiness/gtbi-v7/[A-Za-z0-9._/-]+$","type":"string"},"minItems":1,"type":"array","uniqueItems":true},"evidence_sha256":{"items":{"pattern":"^sha256:[0-9a-f]{64}$","type":"string"},"minItems":1,"type":"array"},"expected_result":{"minLength":1,"type":"string"},"files_touched":{"items":{"pattern":"^docs/readiness/gtbi-v7/[A-Za-z0-9._/-]+$","type":"string"},"type":"array"},"notes":{"type":"string"},"target_status":{"enum":["done","cancelled"]},"task_id":{"pattern":"^PREV7-[0-9]{4}$","type":"string"},"terminal_reason":{"minLength":1,"type":"string"}},"required":["task_id","target_status","evidence_paths","evidence_sha256","terminal_reason","notes","files_touched","expected_result","alternative_completion_receipt_set_digest_or_null"],"type":"object"},"minItems":1,"type":"array"},"transaction_id":{"pattern":"^G(?:0|1A|1B|2|3A|3B|4|5|6|7|8|9|9X|10)_CLOSE-[1-9][0-9]*$","type":"string"}},"required":["schema_version","manifest_id","transaction_id","requested_at_utc","actor_id","actor_role","expected_base_ref","expected_base_sha_mode","task_actions","branch_actions","gate_actions","owner_directive_digest","manifest_digest"],"title":"gtbi_v7_readiness_transition_manifest_v1","type":"object"}
