{"actor_id":"github-user:271768688","actor_role":"repository_owner","branch_actions":[],"expected_base_ref":"refs/heads/main","expected_base_sha_mode":"runtime_default_branch_head","gate_actions":[],"manifest_digest":"sha256:f4fa6b0e59b1023c1b0c207b7d0f6798c34bc419fbe8e551e805387d71885b0e","manifest_id":"g2-provider-terms-acceptance-v1","owner_directive_digest":"sha256:37ccc41b24222952924f7b2ced9a6d1ec2df13fc1cdc38b72df2f8de4894aa78","requested_at_utc":"2026-07-31T18:35:00Z","schema_version":"gtbi_v7_readiness_transition_manifest_v1","task_actions":[{"alternative_completion_receipt_set_digest_or_null":"sha256:81143497524cdafa7dfc85c99c5a648e8c29c11bd5629961b8c7e49ceb398b56","evidence_paths":["docs/readiness/gtbi-v7/g2_provider_terms_acceptance_receipt.json","docs/readiness/gtbi-v7/provider_terms_inventory.json","docs/readiness/gtbi-v7/provider_terms_review.md","docs/readiness/gtbi-v7/owner_decisions.json","docs/readiness/gtbi-v7/owner_simplification_directive.json","docs/readiness/gtbi-v7/local_data_lake_receipt.json","docs/readiness/gtbi-v7/frozen_data_lake_github_release_receipt.json"],"evidence_sha256":["sha256:0a920960946aec7849f9003ff187f807eb7207cfbaa911a650f8f283084a32e2","sha256:9453c63f8301157ab2ce1627eb4402235e43ab00e10b196b12b8edd4fe024eab","sha256:57b31b3f5bcbf97ee101d12c9ea29d657a744caf6d2af0a2d533ea03b636bdec","sha256:e9e09d386ea4627cbd9636d63ae853e8d7b7685a857f3b0c02da6540e636372a","sha256:37ccc41b24222952924f7b2ced9a6d1ec2df13fc1cdc38b72df2f8de4894aa78","sha256:9dbe4ad81f9ac53514c0c8727e0054e890ae2d3b70f703ac8e929d6ca711ce2a","sha256:6017b7bb5cb663235bdb629fcd6a620d52ce8372ce9654ff8eb48fe1d4e56a71"],"expected_result":"Versioned provider/data terms inventory plus repository-owner acceptance","files_touched":["docs/readiness/gtbi-v7/g2_provider_terms_acceptance_receipt.json","docs/readiness/gtbi-v7/provider_terms_inventory.json","docs/readiness/gtbi-v7/provider_terms_review.md","docs/readiness/gtbi-v7/owner_decisions.json","docs/readiness/gtbi-v7/owner_simplification_directive.json","docs/readiness/gtbi-v7/local_data_lake_receipt.json","docs/readiness/gtbi-v7/frozen_data_lake_github_release_receipt.json"],"notes":"The current input is the already frozen data lake. No provider download or new Yahoo collection is authorized. Tiingo remains an optional future refresh source requiring a new owner instruction.","target_status":"done","task_id":"PREV7-0302","terminal_reason":"owner_accepted_versioned_provider_terms_for_frozen_input"}],"transaction_id":"G2_CLOSE-2"}
