{"actor_id":"github-user:271768688","actor_role":"repository_owner","branch_actions":[{"branch_id":"APP_PRIVATE_KEY_IMPORT","decision_receipt_digest":"sha256:cd54bb51bfcbfbfef25b06f660de427dc37500955ce8d92dd52f1a3ca14ba5c5","predicate_evidence_digest":"sha256:cd54bb51bfcbfbfef25b06f660de427dc37500955ce8d92dd52f1a3ca14ba5c5","selected_successor":"owner_controlled_ephemeral_github_token","task_id":"PREV7-0204"}],"expected_base_ref":"refs/heads/main","expected_base_sha_mode":"runtime_default_branch_head","gate_actions":[{"evidence_bundle_digest":"sha256:cd54bb51bfcbfbfef25b06f660de427dc37500955ce8d92dd52f1a3ca14ba5c5","gate_id":"G3A","inventory_snapshot_digest":"sha256:351c656b0983fac5258d0fd9137cdab82cc9a4638f67895bca5048fb628e10e3","selected_branch_id_or_null":"APP_PRIVATE_KEY_IMPORT","target_status":"green"}],"manifest_digest":"sha256:3a3811b6a3523186b27a87ff9d6b265c4a65c920019757f5ddefe4ca73e8f245","manifest_id":"g3a-owner-auth-close-v1","owner_directive_digest":"sha256:37ccc41b24222952924f7b2ced9a6d1ec2df13fc1cdc38b72df2f8de4894aa78","requested_at_utc":"2026-07-31T14:00:00Z","schema_version":"gtbi_v7_readiness_transition_manifest_v1","task_actions":[{"alternative_completion_receipt_set_digest_or_null":"sha256:cd54bb51bfcbfbfef25b06f660de427dc37500955ce8d92dd52f1a3ca14ba5c5","evidence_paths":["docs/readiness/gtbi-v7/g3a_owner_auth_completion_receipt.json","docs/readiness/gtbi-v7/owner_simplification_directive.json","docs/readiness/gtbi-v7/owner_decisions.json","docs/readiness/gtbi-v7/g0_owner_controlled_foundation_report.json","docs/readiness/gtbi-v7/g3a_github_live_receipt.json","docs/readiness/gtbi-v7/frozen_data_lake_github_release_receipt.json","docs/readiness/gtbi-v7/github_packages_inventory_receipt.json"],"evidence_sha256":["sha256:c20743a46aad256a4247c850b9a94e01cac8e6d9498ba576a04e975abc644bcc","sha256:37ccc41b24222952924f7b2ced9a6d1ec2df13fc1cdc38b72df2f8de4894aa78","sha256:e9e09d386ea4627cbd9636d63ae853e8d7b7685a857f3b0c02da6540e636372a","sha256:be514ee69a8cbbbb43e8a041a4ba2d00efec47319de0da36079ec8c2eda2b60b","sha256:351c656b0983fac5258d0fd9137cdab82cc9a4638f67895bca5048fb628e10e3","sha256:6017b7bb5cb663235bdb629fcd6a620d52ce8372ce9654ff8eb48fe1d4e56a71","sha256:c741515c78a2bedbc4d607167b56de84c75c0c30ba082e9a299a7749ca1eec21"],"expected_result":"Production source-App definitions, keys, negative-permission evidence and exact installation-request manifests, plus only the keyless proposed definition/repository-class request for destination-owned `gtbi-dependency-extract`; no destination key creation, repository creation or installation authorization","files_touched":["docs/readiness/gtbi-v7/g3a_owner_auth_completion_receipt.json","docs/readiness/gtbi-v7/owner_simplification_directive.json","docs/readiness/gtbi-v7/owner_decisions.json","docs/readiness/gtbi-v7/g0_owner_controlled_foundation_report.json","docs/readiness/gtbi-v7/g3a_github_live_receipt.json","docs/readiness/gtbi-v7/frozen_data_lake_github_release_receipt.json","docs/readiness/gtbi-v7/github_packages_inventory_receipt.json"],"notes":"Owner-authorized alternative completion uses GitHub's repository-scoped ephemeral token, no permanent App key, no external broker, no incremental spend, no scientific processing and no locked-data access.","target_status":"done","task_id":"PREV7-0204","terminal_reason":"owner_controlled_ephemeral_auth_alternative_verified"},{"alternative_completion_receipt_set_digest_or_null":"sha256:cd54bb51bfcbfbfef25b06f660de427dc37500955ce8d92dd52f1a3ca14ba5c5","evidence_paths":["docs/readiness/gtbi-v7/g3a_owner_auth_completion_receipt.json","docs/readiness/gtbi-v7/owner_simplification_directive.json","docs/readiness/gtbi-v7/owner_decisions.json","docs/readiness/gtbi-v7/g0_owner_controlled_foundation_report.json","docs/readiness/gtbi-v7/g3a_github_live_receipt.json","docs/readiness/gtbi-v7/frozen_data_lake_github_release_receipt.json","docs/readiness/gtbi-v7/github_packages_inventory_receipt.json"],"evidence_sha256":["sha256:c20743a46aad256a4247c850b9a94e01cac8e6d9498ba576a04e975abc644bcc","sha256:37ccc41b24222952924f7b2ced9a6d1ec2df13fc1cdc38b72df2f8de4894aa78","sha256:e9e09d386ea4627cbd9636d63ae853e8d7b7685a857f3b0c02da6540e636372a","sha256:be514ee69a8cbbbb43e8a041a4ba2d00efec47319de0da36079ec8c2eda2b60b","sha256:351c656b0983fac5258d0fd9137cdab82cc9a4638f67895bca5048fb628e10e3","sha256:6017b7bb5cb663235bdb629fcd6a620d52ce8372ce9654ff8eb48fe1d4e56a71","sha256:c741515c78a2bedbc4d607167b56de84c75c0c30ba082e9a299a7749ca1eec21"],"expected_result":"Exact source App installations and complete GitHub environment set authorized by the owner; destination-owned `gtbi-dependency-extract` remains an uninstalled keyless request until PREV7-0308, disposable repositories remain owner-created through the isolated-org ceremony and locked access stays disabled","files_touched":["docs/readiness/gtbi-v7/g3a_owner_auth_completion_receipt.json","docs/readiness/gtbi-v7/owner_simplification_directive.json","docs/readiness/gtbi-v7/owner_decisions.json","docs/readiness/gtbi-v7/g0_owner_controlled_foundation_report.json","docs/readiness/gtbi-v7/g3a_github_live_receipt.json","docs/readiness/gtbi-v7/frozen_data_lake_github_release_receipt.json","docs/readiness/gtbi-v7/github_packages_inventory_receipt.json"],"notes":"Owner-authorized alternative completion uses GitHub's repository-scoped ephemeral token, no permanent App key, no external broker, no incremental spend, no scientific processing and no locked-data access.","target_status":"done","task_id":"PREV7-0210","terminal_reason":"owner_controlled_environments_and_auth_verified"}],"transaction_id":"G3A_CLOSE-2"}
