{"actor_id":"github-user:271768688","actor_role":"repository_owner","branch_actions":[],"expected_base_ref":"refs/heads/main","expected_base_sha_mode":"runtime_default_branch_head","gate_actions":[{"evidence_bundle_digest":"sha256:cc1e8de4880d885671de79972458ce5fe541dba92b53082c20fd51c07b7ed3f4","gate_id":"G1B","inventory_snapshot_digest":"sha256:3a93d655520be90818b81df0179cdbde35ca82aea4229292806619758ed300be","selected_branch_id_or_null":null,"target_status":"green"}],"manifest_digest":"sha256:43d85841444693f1f6bd4b51a50afdeb521735995d9d3d34d52f56aa6f820d1b","manifest_id":"g1b-role-registry-close-v1","owner_directive_digest":"sha256:37ccc41b24222952924f7b2ced9a6d1ec2df13fc1cdc38b72df2f8de4894aa78","requested_at_utc":"2026-07-30T18:30:00Z","schema_version":"gtbi_v7_readiness_transition_manifest_v1","task_actions":[{"alternative_completion_receipt_set_digest_or_null":null,"evidence_paths":["docs/readiness/gtbi-v7/g1b_role_registry_receipt.json","docs/readiness/gtbi-v7/owner_simplification_directive.json","docs/readiness/gtbi-v7/g1a_state_transition_reconciliation_receipt.json"],"evidence_sha256":["sha256:b75541b5cae1a2236ebafa7b749496f746aef0e4b4877fbaf58f9eb96cc4ffc9","sha256:37ccc41b24222952924f7b2ced9a6d1ec2df13fc1cdc38b72df2f8de4894aa78","sha256:dbc20315404150f6f306d597d338fed7d0883a76ebace30b1dd5083723fb219f"],"expected_result":"Owner-controlled responsibility registry mapping legacy capability labels to the owner or automation; no vacancies, incompatibility separation or additional people required","files_touched":["docs/readiness/gtbi-v7/g1b_role_registry_receipt.json","docs/readiness/gtbi-v7/owner_simplification_directive.json","docs/readiness/gtbi-v7/g1a_state_transition_reconciliation_receipt.json"],"notes":"Legacy capability labels are assigned to the repository owner under the explicit simplification directive; no additional people, scientific work or locked access.","target_status":"done","task_id":"PREV7-0201","terminal_reason":"owner_controlled_role_registry_accepted"}],"transaction_id":"G1B_CLOSE-1"}
