{"actor_id":"github-user:271768688","actor_role":"repository_owner","branch_actions":[],"expected_base_ref":"refs/heads/main","expected_base_sha_mode":"runtime_default_branch_head","gate_actions":[{"evidence_bundle_digest":"sha256:4485b44ad8702662072d8b936d4d13b7adfbfdebb66cfc7a961903dfa74e2394","gate_id":"G1A","inventory_snapshot_digest":"sha256:3a93d655520be90818b81df0179cdbde35ca82aea4229292806619758ed300be","selected_branch_id_or_null":null,"target_status":"green"}],"manifest_digest":"sha256:5206efcc4e0582226c31b47fa0876377a37b26abb4f11d44a7a80e50d8ec9e5d","manifest_id":"g1a-identity-close-v1","owner_directive_digest":"sha256:37ccc41b24222952924f7b2ced9a6d1ec2df13fc1cdc38b72df2f8de4894aa78","requested_at_utc":"2026-07-30T18:00:00Z","schema_version":"gtbi_v7_readiness_transition_manifest_v1","task_actions":[{"alternative_completion_receipt_set_digest_or_null":null,"evidence_paths":["docs/readiness/gtbi-v7/v7_identity_scope_receipt.json","docs/readiness/gtbi-v7/owner_decisions.json","docs/readiness/gtbi-v7/g0_state_transition_reconciliation_receipt.json"],"evidence_sha256":["sha256:97f1e88e3f9449652028dc546a415f55cff09df3e01e37f52659bedd5c83091d","sha256:e9e09d386ea4627cbd9636d63ae853e8d7b7685a857f3b0c02da6540e636372a","sha256:61b889740d354c2168fb865e40c6124e28feeb187ce800e0e9d87f9a0262ae64"],"expected_result":"Unified V7 target recorded only after bootstrap genesis exists","files_touched":["docs/readiness/gtbi-v7/v7_identity_scope_receipt.json","docs/readiness/gtbi-v7/owner_decisions.json","docs/readiness/gtbi-v7/g0_state_transition_reconciliation_receipt.json"],"notes":"Owner-controlled G1A identity acceptance; no scientific execution or locked-data access.","target_status":"done","task_id":"PREV7-0101","terminal_reason":"unified_v7_target_owner_accepted"},{"alternative_completion_receipt_set_digest_or_null":null,"evidence_paths":["docs/readiness/gtbi-v7/v7_identity_scope_receipt.json","docs/readiness/gtbi-v7/owner_decisions.json","docs/readiness/gtbi-v7/g0_state_transition_reconciliation_receipt.json"],"evidence_sha256":["sha256:97f1e88e3f9449652028dc546a415f55cff09df3e01e37f52659bedd5c83091d","sha256:e9e09d386ea4627cbd9636d63ae853e8d7b7685a857f3b0c02da6540e636372a","sha256:61b889740d354c2168fb865e40c6124e28feeb187ce800e0e9d87f9a0262ae64"],"expected_result":"V7 identity and exclusions ADR","files_touched":["docs/readiness/gtbi-v7/v7_identity_scope_receipt.json","docs/readiness/gtbi-v7/owner_decisions.json","docs/readiness/gtbi-v7/g0_state_transition_reconciliation_receipt.json"],"notes":"Owner-controlled G1A identity acceptance; no scientific execution or locked-data access.","target_status":"done","task_id":"PREV7-0102","terminal_reason":"v7_identity_and_exclusions_adr_accepted"},{"alternative_completion_receipt_set_digest_or_null":null,"evidence_paths":["docs/readiness/gtbi-v7/v7_identity_scope_receipt.json","docs/readiness/gtbi-v7/owner_decisions.json","docs/readiness/gtbi-v7/g0_state_transition_reconciliation_receipt.json"],"evidence_sha256":["sha256:97f1e88e3f9449652028dc546a415f55cff09df3e01e37f52659bedd5c83091d","sha256:e9e09d386ea4627cbd9636d63ae853e8d7b7685a857f3b0c02da6540e636372a","sha256:61b889740d354c2168fb865e40c6124e28feeb187ce800e0e9d87f9a0262ae64"],"expected_result":"Scope and non-goals approval","files_touched":["docs/readiness/gtbi-v7/v7_identity_scope_receipt.json","docs/readiness/gtbi-v7/owner_decisions.json","docs/readiness/gtbi-v7/g0_state_transition_reconciliation_receipt.json"],"notes":"Owner-controlled G1A identity acceptance; no scientific execution or locked-data access.","target_status":"done","task_id":"PREV7-0103","terminal_reason":"v7_scope_and_non_goals_owner_accepted"}],"transaction_id":"G1A_CLOSE-1"}
