{"actor_id":"github-user:271768688","actor_role":"repository_owner","branch_actions":[],"expected_base_ref":"refs/heads/main","expected_base_sha_mode":"runtime_default_branch_head","gate_actions":[],"manifest_digest":"sha256:50ddba0f98d66ef25c24407ccf8ce88a1ba8e64ed76ff57e57c286746fb25deb","manifest_id":"g3b-stage-two-owner-v1","owner_directive_digest":"sha256:37ccc41b24222952924f7b2ced9a6d1ec2df13fc1cdc38b72df2f8de4894aa78","requested_at_utc":"2026-07-31T16:15:00Z","schema_version":"gtbi_v7_readiness_transition_manifest_v1","task_actions":[{"alternative_completion_receipt_set_digest_or_null":"sha256:a5c2d62a8659f343f0b62e827f17bfea9de2c0167514331c181c17a451745798","evidence_paths":["docs/readiness/gtbi-v7/g3b_stage_two_owner_live_receipt.json","docs/readiness/gtbi-v7/owner_simplification_directive.json","docs/readiness/gtbi-v7/owner_decisions.json"],"evidence_sha256":["sha256:9be81accbfc13685e63e7ed69760df03946bcaa5f0193a900d39a02c3dc89fc1","sha256:37ccc41b24222952924f7b2ced9a6d1ec2df13fc1cdc38b72df2f8de4894aa78","sha256:e9e09d386ea4627cbd9636d63ae853e8d7b7685a857f3b0c02da6540e636372a"],"expected_result":"Stage-two protection and owner-approved automated environment checks","files_touched":["docs/readiness/gtbi-v7/g3b_stage_two_owner_live_receipt.json","docs/readiness/gtbi-v7/owner_simplification_directive.json","docs/readiness/gtbi-v7/owner_decisions.json"],"notes":"Live GitHub main protection requires the unconditional owner-approved automated check. Human approvals remain non-blocking under the owner directive. Locked access remains closed and incremental spend is zero.","target_status":"done","task_id":"PREV7-0207","terminal_reason":"owner_controlled_stage_two_protection_verified"}],"transaction_id":"G3B_CLOSE-2"}
