{"actor_id":"github-user:271768688","actor_role":"repository_owner","branch_actions":[{"branch_id":"V6_INPUT_IDENTITY","decision_receipt_digest":"sha256:23f15572c134811b519218df704d24177d65c9c03df7dc75b68a2760e72624e8","predicate_evidence_digest":"sha256:310af2264fb193bc36b6d6e9b7a1022d194b8e8e86d2a82a36f6b10686e8be94","selected_successor":"separate_reference_proposal_and_no_go_close","task_id":"PREV7-0307"}],"expected_base_ref":"refs/heads/main","expected_base_sha_mode":"runtime_default_branch_head","gate_actions":[],"manifest_digest":"sha256:725e816547b9181dcda5e16fb084718f5d8630bb6580a597845d07b4cfe8971d","manifest_id":"g2-v6-input-identity-no-baseline-v1","owner_directive_digest":"sha256:37ccc41b24222952924f7b2ced9a6d1ec2df13fc1cdc38b72df2f8de4894aa78","requested_at_utc":"2026-08-01T06:30:00Z","schema_version":"gtbi_v7_readiness_transition_manifest_v1","task_actions":[{"alternative_completion_receipt_set_digest_or_null":"sha256:23f15572c134811b519218df704d24177d65c9c03df7dc75b68a2760e72624e8","evidence_paths":["docs/readiness/gtbi-v7/g2_v6_input_identity_decision_receipt.json","docs/readiness/gtbi-v7/new_reference_proposal.json","docs/readiness/gtbi-v7/g2_reproducibility_classification_receipt.json","docs/readiness/gtbi-v7/v6_dependency_recovery_report.json","docs/readiness/gtbi-v7/local_data_lake_receipt.json","docs/readiness/gtbi-v7/frozen_data_lake_github_release_receipt.json","docs/readiness/gtbi-v7/g2_provider_terms_acceptance_receipt.json","docs/readiness/gtbi-v7/owner_simplification_directive.json"],"evidence_sha256":["sha256:40bef612be40a175c35a44a3fa0a80347b64ee96780e20ccea06a35397ae2baf","sha256:03416f19b47d958498f42fd7e347c57ea813396a47279203b39ccfdfa274f9c9","sha256:d572c255766703ee6e4289b98d5d31cae9032146accf5a2d038973561cf4d537","sha256:19627a5c7ae05ffd36f810ba55d240989d1eda183c3d190fe12837329fd1f1c2","sha256:9dbe4ad81f9ac53514c0c8727e0054e890ae2d3b70f703ac8e929d6ca711ce2a","sha256:6017b7bb5cb663235bdb629fcd6a620d52ce8372ce9654ff8eb48fe1d4e56a71","sha256:0a920960946aec7849f9003ff187f807eb7207cfbaa911a650f8f283084a32e2","sha256:37ccc41b24222952924f7b2ced9a6d1ec2df13fc1cdc38b72df2f8de4894aa78"],"expected_result":"Authenticated V6 input identity, or hashed no-V7-baseline decision plus separately scoped future-reference proposal that leaves G5/full blocked","files_touched":["docs/readiness/gtbi-v7/g2_v6_input_identity_decision_receipt.json","docs/readiness/gtbi-v7/new_reference_proposal.json","docs/readiness/gtbi-v7/g2_reproducibility_classification_receipt.json","docs/readiness/gtbi-v7/v6_dependency_recovery_report.json","docs/readiness/gtbi-v7/local_data_lake_receipt.json","docs/readiness/gtbi-v7/frozen_data_lake_github_release_receipt.json","docs/readiness/gtbi-v7/g2_provider_terms_acceptance_receipt.json","docs/readiness/gtbi-v7/owner_simplification_directive.json"],"notes":"The original V6 D0, D1 and D2 identities are not authenticated. The frozen local bytes are recorded only as an unapproved separate reference proposal. Current V7 gates remain red and NO_GO closure is required.","target_status":"done","task_id":"PREV7-0307","terminal_reason":"no_authenticated_v6_inputs_separate_reference_only"}],"transaction_id":"G2_CLOSE-7"}
