{"actor_id":"github-user:271768688","actor_role":"repository_owner","branch_actions":[],"expected_base_ref":"refs/heads/main","expected_base_sha_mode":"runtime_default_branch_head","gate_actions":[],"manifest_digest":"sha256:8f018f381264251c22008f3859c8e0c49a25a2b0fd13c800d0a1d9df1365ee50","manifest_id":"g2-scientific-asset-contract-v1","owner_directive_digest":"sha256:37ccc41b24222952924f7b2ced9a6d1ec2df13fc1cdc38b72df2f8de4894aa78","requested_at_utc":"2026-07-31T18:50:00Z","schema_version":"gtbi_v7_readiness_transition_manifest_v1","task_actions":[{"alternative_completion_receipt_set_digest_or_null":"sha256:5217d314accc30da6de5865df9a415fd47b8fa81834f18fdd80f95bb4642d5bc","evidence_paths":["docs/readiness/gtbi-v7/g2_scientific_asset_contract_receipt.json","docs/readiness/gtbi-v7/owner_simplification_directive.json"],"evidence_sha256":["sha256:6d9b30d8f741013fa5fd89b394192fac4ce5ea4338702637ea41ba7145226d31","sha256:37ccc41b24222952924f7b2ced9a6d1ec2df13fc1cdc38b72df2f8de4894aa78"],"expected_result":"Versioned transport-classified `scientific_asset_manifest_v1` schema, registered hash domain, lifecycle/nullability validator and immutable-wrapper fixtures","files_touched":["docs/readiness/gtbi-v7/g2_scientific_asset_contract_receipt.json","docs/readiness/gtbi-v7/owner_simplification_directive.json"],"notes":"The closed schema, registered hash domain, lifecycle/nullability validator and immutable wrapper are frozen without scientific or locked-data execution.","target_status":"done","task_id":"PREV7-0303","terminal_reason":"scientific_asset_contract_frozen"}],"transaction_id":"G2_CLOSE-3"}
