{"actor_id":"github-user:271768688","actor_role":"repository_owner","branch_actions":[],"expected_base_ref":"refs/heads/main","expected_base_sha_mode":"runtime_default_branch_head","gate_actions":[],"manifest_digest":"sha256:f264ce80c4cd36d1f2b8c6dec6eb70d1a51fb97c634bc35824e6e7a004e9dd9d","manifest_id":"state-controller-smoke-v1","owner_directive_digest":"sha256:e9e09d386ea4627cbd9636d63ae853e8d7b7685a857f3b0c02da6540e636372a","requested_at_utc":"2026-07-30T15:00:00Z","schema_version":"gtbi_v7_readiness_transition_manifest_v1","task_actions":[{"alternative_completion_receipt_set_digest_or_null":null,"evidence_paths":["docs/readiness/gtbi-v7/inventory_github_actions_attempt_receipt.json"],"evidence_sha256":["sha256:f1e48c9379d1339fa8a93eab5aa6dfd40644c7ea26c01e2ef3c725dd0c8a3b1d"],"expected_result":"inventory_evidence_complete","files_touched":["docs/readiness/gtbi-v7/inventory_github_actions_attempt_receipt.json","docs/readiness/gtbi-v7/g0_owner_controlled_foundation_report.json"],"notes":"Dry-run-only smoke projection over reviewed G0 evidence.","target_status":"done","task_id":"PREV7-0001","terminal_reason":"github_inventory_verified"}],"transaction_id":"G0_CLOSE-1"}
