{"actor_id":"github-user:271768688","actor_role":"repository_owner","branch_actions":[],"expected_base_ref":"refs/heads/main","expected_base_sha_mode":"runtime_default_branch_head","gate_actions":[],"manifest_digest":"sha256:09f94e5cd586dbe41137e619bb8104643c3f7a91f9c096ec5ae8f16764c3eafa","manifest_id":"g2-v6-production-promotion-restore-v1","owner_directive_digest":"sha256:37ccc41b24222952924f7b2ced9a6d1ec2df13fc1cdc38b72df2f8de4894aa78","requested_at_utc":"2026-07-31T19:50:00Z","schema_version":"gtbi_v7_readiness_transition_manifest_v1","task_actions":[{"alternative_completion_receipt_set_digest_or_null":"sha256:823036480e164a02e4e7bde886c1ccae2cafa20f01bfd81e04a200655b1825bf","evidence_paths":["docs/readiness/gtbi-v7/g2_v6_production_promotion_restore_receipt.json","docs/readiness/gtbi-v7/v6_durable_preservation_receipt.json","docs/readiness/gtbi-v7/v6_final_result_scientific_asset_manifest.json","docs/readiness/gtbi-v7/g2_retention_policy_receipt.json","docs/readiness/gtbi-v7/g2_provider_terms_acceptance_receipt.json","docs/readiness/gtbi-v7/owner_simplification_directive.json"],"evidence_sha256":["sha256:12da87aebe35f117528460d5a8a0af6e9f3dd6fcf96ce71b7af50bf2d3fd102a","sha256:0f3ee5bbe2dd354f94ea96933862470923489803db757b114cfa93d034d45a27","sha256:7df9619dd3d9bad6447fc7ab84f588ee732538062386a4d983068c3e738ea0b4","sha256:206fa06f342f34b110072b0e7ae49d6979c444f96cb007b60c84c5fb7eec92d3","sha256:0a920960946aec7849f9003ff187f807eb7207cfbaa911a650f8f283084a32e2","sha256:37ccc41b24222952924f7b2ced9a6d1ec2df13fc1cdc38b72df2f8de4894aa78"],"expected_result":"Emergency V6 archive promoted to production policy","files_touched":["docs/readiness/gtbi-v7/g2_v6_production_promotion_restore_receipt.json","docs/readiness/gtbi-v7/v6_durable_preservation_receipt.json","docs/readiness/gtbi-v7/v6_final_result_scientific_asset_manifest.json","docs/readiness/gtbi-v7/g2_retention_policy_receipt.json","docs/readiness/gtbi-v7/g2_provider_terms_acceptance_receipt.json","docs/readiness/gtbi-v7/owner_simplification_directive.json"],"notes":"The byte-identical primary and owner mirror package is promoted under the active zero-incremental-spend production policy.","target_status":"done","task_id":"PREV7-0304","terminal_reason":"v6_archive_promoted_without_reupload"},{"alternative_completion_receipt_set_digest_or_null":"sha256:823036480e164a02e4e7bde886c1ccae2cafa20f01bfd81e04a200655b1825bf","evidence_paths":["docs/readiness/gtbi-v7/g2_v6_production_promotion_restore_receipt.json","docs/readiness/gtbi-v7/v6_durable_preservation_receipt.json","docs/readiness/gtbi-v7/v6_final_result_scientific_asset_manifest.json","docs/readiness/gtbi-v7/g2_retention_policy_receipt.json","docs/readiness/gtbi-v7/g2_provider_terms_acceptance_receipt.json","docs/readiness/gtbi-v7/owner_simplification_directive.json"],"evidence_sha256":["sha256:12da87aebe35f117528460d5a8a0af6e9f3dd6fcf96ce71b7af50bf2d3fd102a","sha256:0f3ee5bbe2dd354f94ea96933862470923489803db757b114cfa93d034d45a27","sha256:7df9619dd3d9bad6447fc7ab84f588ee732538062386a4d983068c3e738ea0b4","sha256:206fa06f342f34b110072b0e7ae49d6979c444f96cb007b60c84c5fb7eec92d3","sha256:0a920960946aec7849f9003ff187f807eb7207cfbaa911a650f8f283084a32e2","sha256:37ccc41b24222952924f7b2ced9a6d1ec2df13fc1cdc38b72df2f8de4894aa78"],"expected_result":"Clean-runner restoration proof","files_touched":["docs/readiness/gtbi-v7/g2_v6_production_promotion_restore_receipt.json","docs/readiness/gtbi-v7/v6_durable_preservation_receipt.json","docs/readiness/gtbi-v7/v6_final_result_scientific_asset_manifest.json","docs/readiness/gtbi-v7/g2_retention_policy_receipt.json","docs/readiness/gtbi-v7/g2_provider_terms_acceptance_receipt.json","docs/readiness/gtbi-v7/owner_simplification_directive.json"],"notes":"Primary and mirror restore independently on clean GitHub runners, match the same archive and source bundle, and stay inside RTO.","target_status":"done","task_id":"PREV7-0305","terminal_reason":"two_clean_github_runner_restores_verified"}],"transaction_id":"G2_CLOSE-5"}
