{"actor_id":"github-user:271768688","actor_role":"repository_owner","branch_actions":[],"expected_base_ref":"refs/heads/main","expected_base_sha_mode":"runtime_default_branch_head","gate_actions":[],"manifest_digest":"sha256:0195c8919f548ccf67252e6ac53a46067c8910064d377821b952f2a6813f7de2","manifest_id":"g3b-codeowners-owner-v1","owner_directive_digest":"sha256:37ccc41b24222952924f7b2ced9a6d1ec2df13fc1cdc38b72df2f8de4894aa78","requested_at_utc":"2026-07-31T14:37:36Z","schema_version":"gtbi_v7_readiness_transition_manifest_v1","task_actions":[{"alternative_completion_receipt_set_digest_or_null":"sha256:eef58adc1c42030e7ebcbfda05c99ddf4604326b72067e23ed3c8b28ad283828","evidence_paths":["docs/readiness/gtbi-v7/g3b_codeowners_owner_receipt.json","docs/readiness/gtbi-v7/owner_simplification_directive.json","docs/readiness/gtbi-v7/owner_decisions.json"],"evidence_sha256":["sha256:5da90f37fcff2ed4f100acad5effb020542fda38e09a0ef2a3c8b5995251b8c8","sha256:37ccc41b24222952924f7b2ced9a6d1ec2df13fc1cdc38b72df2f8de4894aa78","sha256:e9e09d386ea4627cbd9636d63ae853e8d7b7685a857f3b0c02da6540e636372a"],"expected_result":"CODEOWNERS with the repository owner","files_touched":["docs/readiness/gtbi-v7/g3b_codeowners_owner_receipt.json","docs/readiness/gtbi-v7/owner_simplification_directive.json","docs/readiness/gtbi-v7/owner_decisions.json"],"notes":"Owner-controlled CODEOWNERS covers every protected path listed by the plan. It routes to the verified repository owner and remains non-blocking until stage two.","target_status":"done","task_id":"PREV7-0203","terminal_reason":"owner_controlled_codeowners_verified"}],"transaction_id":"G3B_CLOSE-1"}
