{"actor_id":"github-user:271768688","actor_role":"repository_owner","branch_actions":[],"expected_base_ref":"refs/heads/main","expected_base_sha_mode":"runtime_default_branch_head","gate_actions":[],"manifest_digest":"sha256:7fd354440d0d39b2805756fdcba28089f3534bdcad00ceb63cff0a101befb3a1","manifest_id":"g3a-minimum-governance-close-v1","owner_directive_digest":"sha256:37ccc41b24222952924f7b2ced9a6d1ec2df13fc1cdc38b72df2f8de4894aa78","requested_at_utc":"2026-07-30T22:30:00Z","schema_version":"gtbi_v7_readiness_transition_manifest_v1","task_actions":[{"alternative_completion_receipt_set_digest_or_null":null,"evidence_paths":["docs/readiness/gtbi-v7/g3a_github_live_receipt.json","docs/readiness/gtbi-v7/owner_simplification_directive.json"],"evidence_sha256":["sha256:351c656b0983fac5258d0fd9137cdab82cc9a4638f67895bca5048fb628e10e3","sha256:37ccc41b24222952924f7b2ced9a6d1ec2df13fc1cdc38b72df2f8de4894aa78"],"expected_result":"Stage-one main protection; stage two pending reviewer","files_touched":["docs/readiness/gtbi-v7/g3a_github_live_receipt.json","docs/readiness/gtbi-v7/owner_simplification_directive.json"],"notes":"Live GitHub state and repository policy satisfy this minimum G3A task without scientific work, locked access or incremental spend. Source App tasks remain blocked until provider web authorization returns live IDs.","target_status":"done","task_id":"PREV7-0202","terminal_reason":"stage_one_main_protection_verified"},{"alternative_completion_receipt_set_digest_or_null":null,"evidence_paths":["docs/readiness/gtbi-v7/g3a_github_live_receipt.json","docs/readiness/gtbi-v7/owner_simplification_directive.json"],"evidence_sha256":["sha256:351c656b0983fac5258d0fd9137cdab82cc9a4638f67895bca5048fb628e10e3","sha256:37ccc41b24222952924f7b2ced9a6d1ec2df13fc1cdc38b72df2f8de4894aa78"],"expected_result":"Pinned Actions and minimum permissions","files_touched":["docs/readiness/gtbi-v7/g3a_github_live_receipt.json","docs/readiness/gtbi-v7/owner_simplification_directive.json"],"notes":"Live GitHub state and repository policy satisfy this minimum G3A task without scientific work, locked access or incremental spend. Source App tasks remain blocked until provider web authorization returns live IDs.","target_status":"done","task_id":"PREV7-0205","terminal_reason":"pinned_actions_and_minimum_permissions_verified"},{"alternative_completion_receipt_set_digest_or_null":null,"evidence_paths":["docs/readiness/gtbi-v7/g3a_github_live_receipt.json","docs/readiness/gtbi-v7/owner_simplification_directive.json"],"evidence_sha256":["sha256:351c656b0983fac5258d0fd9137cdab82cc9a4638f67895bca5048fb628e10e3","sha256:37ccc41b24222952924f7b2ced9a6d1ec2df13fc1cdc38b72df2f8de4894aa78"],"expected_result":"Dependabot, CodeQL, secret scanning and push-protection baseline","files_touched":["docs/readiness/gtbi-v7/g3a_github_live_receipt.json","docs/readiness/gtbi-v7/owner_simplification_directive.json"],"notes":"Live GitHub state and repository policy satisfy this minimum G3A task without scientific work, locked access or incremental spend. Source App tasks remain blocked until provider web authorization returns live IDs.","target_status":"done","task_id":"PREV7-0206","terminal_reason":"github_security_baseline_verified"}],"transaction_id":"G3A_CLOSE-1"}
