{"actor_id":"github-user:271768688","actor_role":"repository_owner","branch_actions":[],"expected_base_ref":"refs/heads/main","expected_base_sha_mode":"runtime_default_branch_head","gate_actions":[],"manifest_digest":"sha256:a11a52aac30e2f0a2999fad92cabf187df81a78c15b477208d2cb49b4795c270","manifest_id":"g3b-preservation-owner-v1","owner_directive_digest":"sha256:37ccc41b24222952924f7b2ced9a6d1ec2df13fc1cdc38b72df2f8de4894aa78","requested_at_utc":"2026-07-31T17:00:00Z","schema_version":"gtbi_v7_readiness_transition_manifest_v1","task_actions":[{"alternative_completion_receipt_set_digest_or_null":"sha256:b00f89e4e2de60fe264e08c67ca4fc25d06af4839f9c81eac13e279e8e2f402c","evidence_paths":["docs/readiness/gtbi-v7/g3b_preservation_owner_live_receipt.json","docs/readiness/gtbi-v7/v6_preservation_lease_public_receipt.json","docs/readiness/gtbi-v7/owner_simplification_directive.json","docs/readiness/gtbi-v7/owner_decisions.json"],"evidence_sha256":["sha256:d950462dd7140e555bbd27c3848a7ade0a3a85fdcae2e2226a1e877f413537b6","sha256:d6951dc592f251fd43b7b5ea7a97c700a575ef7b18a5a3b6d8a671ebf66fa22f","sha256:37ccc41b24222952924f7b2ced9a6d1ec2df13fc1cdc38b72df2f8de4894aa78","sha256:e9e09d386ea4627cbd9636d63ae853e8d7b7685a857f3b0c02da6540e636372a"],"expected_result":"Verified GitHub preservation lease and restore procedure","files_touched":["docs/readiness/gtbi-v7/g3b_preservation_owner_live_receipt.json","docs/readiness/gtbi-v7/v6_preservation_lease_public_receipt.json","docs/readiness/gtbi-v7/owner_simplification_directive.json","docs/readiness/gtbi-v7/owner_decisions.json"],"notes":"The owner accepted the live GitHub preservation lease as sufficient. The restore procedure is digest-bound and GitHub-only; no external custodian, locked access, scientific work or incremental spend is required.","target_status":"done","task_id":"PREV7-0208","terminal_reason":"owner_accepted_github_preservation_lease_verified"}],"transaction_id":"G3B_CLOSE-3"}
